{
  "schemaVersion": "sovereign-character-constitutional/1.0",
  "status": "core-enforced-fixture-not-production-character",
  "characterId": "anthro-fixture-character",
  "sculptDocumentId": "anthro-fixture-v1",
  "rigId": "anthro-standard-v1",
  "species": "anthro",
  "genderMetadata": {
    "identity": "creator-specified",
    "attribution": "creator-authored"
  },
  "rigVersion": "character-rig/1.0",
  "topology": {
    "state": "locked",
    "revision": 0
  },
  "digests": {
    "speciesDigest": "71c3a6bf383f0d04f5f269c007efd34df1a7c4248404adb9ceb9227a706dd589",
    "genderDigest": "542193ed5f4f58b47dcd06af312f54cce9548835d33d13a423a618eebc189c27",
    "rigVersionDigest": "4c2df2407e6bda8d9a8e6425f0a443d0ad0623e8c647cc00448c50b6eed02aad",
    "meshDigest": "6ec8445cc97937c5c69f98eb558bf713f81483888263fad1ec891eb823ae99f5",
    "topologyDigest": "351b3632f7dcb1ae8fa69f4adaf9a316ba05c052d991dc09e684e1d9d990d420",
    "vertexOrderDigest": "28ec98f34c6e8483072e231b5607b9d5f824cf4eb7282448d4ff40c865fd957c",
    "uvDigest": "6a028e3cbe2b40d15fa4731014b0d3f4cf3436a4c1eff182927c133a8e6bd64b",
    "armatureDigest": "e4d277b937c4e5970e7e0b6e45ca2845d7bbead7a74c831e27a7544bf81baa52",
    "blendshapeDigest": "4590c5c201f9d48d4213f746c8ea23c3ad53a1e00f7235da84afb9c73d542147",
    "materialDigest": "3b1cd4eb40c8db99c1ac3061d1c0d6b7955c44bc0acce91f5d78ced27a6e1a97",
    "glbDigest": "0ea25d0614b1a99a0ee86df6c8d263b7f7dc7537240e5a382a3983a88da5cef0",
    "sourceDigest": "132b43a0b7230f9f70ec13a16f77a6bd04ea832a530bb381755325a30773a156",
    "documentDigest": "88e5dad9072ff0a4750e7e429f180449ced8562ac0633c5e85bc7c07b6489207",
    "rigDigest": "a2113bc4ff1468e0c716e49cef170a4ded47232f471642f76423630499be6bda",
    "skinDigest": "09010c2e15f6ec4032713ca3f4181090599460cd991803694b2dc8d094bfe484",
    "textureDigest": "cc3f39385462ba617ea14e87941638eeb40398b010a73e0be3e67c12d41f41b4"
  },
  "skinLayers": [
    {
      "schemaVersion": "sovereign-skin-layer/1.0",
      "id": "anthro-anime-whole-body-skin-v1",
      "version": "1.0.0",
      "bodyCoverage": "whole-body",
      "rigId": "anthro-standard-v1",
      "sculptDocumentId": "anthro-fixture-v1",
      "topologyDigest": "351b3632f7dcb1ae8fa69f4adaf9a316ba05c052d991dc09e684e1d9d990d420",
      "uvDigest": "6a028e3cbe2b40d15fa4731014b0d3f4cf3436a4c1eff182927c133a8e6bd64b",
      "materialRegions": [
        {
          "id": "whole-body",
          "sculptRegionId": "body",
          "materialId": "anime-cel-body"
        }
      ],
      "textureChannels": {
        "baseColor": {
          "assetRef": "asset://non-production/anthro/base-color.png",
          "digest": "6063710fe74a8c43fbe364a018cbc2dc3fb4ef156eddb89f2115536a61e8347c",
          "mimeType": "image/png",
          "colorSpace": "srgb"
        },
        "celShade": {
          "assetRef": "asset://non-production/anthro/cel-shade.png",
          "digest": "8e728422fa4d372704b8f076936ffeaf0b4f3f7e2d94590e869c35f06eefec02",
          "mimeType": "image/png",
          "colorSpace": "srgb"
        },
        "normalDetail": {
          "assetRef": "asset://non-production/anthro/normal-detail.png",
          "digest": "fee66e9534a74b9938b02a5307c808fbfd90c086eaf8dcb69099305415719f5a",
          "mimeType": "image/png",
          "colorSpace": "linear"
        },
        "roughness": {
          "assetRef": "asset://non-production/anthro/roughness.png",
          "digest": "48b655a5654d94de109425d0e900776bea58e11c9c3c7d606fe2342fb5e29585",
          "mimeType": "image/png",
          "colorSpace": "linear"
        },
        "fur": {
          "assetRef": "asset://non-production/anthro/fur.png",
          "digest": "801691bbeb6c4c165f2c3a20ebeccb3b61278e47c4fb2fae0ad96709012a733d",
          "mimeType": "image/png",
          "colorSpace": "srgb"
        },
        "marking": {
          "assetRef": "asset://non-production/anthro/marking.png",
          "digest": "3943ff9cd8bf973682a916c2a85134f5d46f773be882fda9964c4c78c787f6ae",
          "mimeType": "image/png",
          "colorSpace": "srgb"
        }
      },
      "generationProvenance": {
        "method": "governed-model",
        "generatorId": "mandala-anime-surface-painter-fixture",
        "generatorVersion": "1.0.0",
        "authorityRef": "authority://fixture-operator",
        "rightsRef": "rights://non-production-original-fixture",
        "inputDigests": [
          "132b43a0b7230f9f70ec13a16f77a6bd04ea832a530bb381755325a30773a156"
        ]
      },
      "surfaceOnly": true,
      "anatomyMutationAllowed": false
    }
  ],
  "skinLayerDigests": [
    "38cd259041fc2610dd7cc3e20c55a6769ab2fcc3f54298315c2e6ea1da883ec5"
  ],
  "diffusionPolicy": {
    "purpose": "surface-polish-only",
    "anatomyMutationAllowed": false,
    "topologyMutationAllowed": false,
    "geometryDisplacementAllowed": false,
    "runtimeRetopologyAllowed": false
  },
  "recordDigest": "41e8955d591d1a94ef875910eede0d7fc05da172c3ee0e48f2bdff7b6d247cae"
}
